agent.agent_index,agent.agent_instruction,agent.agent_name,answer.vote_punish_high,answer.vote_punish_low,cache_keys.vote_punish_high_cache_key,cache_keys.vote_punish_low_cache_key,cache_used.vote_punish_high_cache_used,cache_used.vote_punish_low_cache_used,comment.vote_punish_high_comment,comment.vote_punish_low_comment,generated_tokens.vote_punish_high_generated_tokens,generated_tokens.vote_punish_low_generated_tokens,iteration.iteration,model.frequency_penalty,model.inference_service,model.logprobs,model.max_tokens,model.model,model.model_index,model.presence_penalty,model.reasoning_effort,model.temperature,model.top_logprobs,model.top_p,prompt.vote_punish_high_system_prompt,prompt.vote_punish_high_user_prompt,prompt.vote_punish_low_system_prompt,prompt.vote_punish_low_user_prompt,question_options.vote_punish_high_question_options,question_options.vote_punish_low_question_options,question_text.vote_punish_high_question_text,question_text.vote_punish_low_question_text,question_type.vote_punish_high_question_type,question_type.vote_punish_low_question_type,raw_model_response.vote_punish_high_cost,raw_model_response.vote_punish_high_input_price_per_million_tokens,raw_model_response.vote_punish_high_input_tokens,raw_model_response.vote_punish_high_one_usd_buys,raw_model_response.vote_punish_high_output_price_per_million_tokens,raw_model_response.vote_punish_high_output_tokens,raw_model_response.vote_punish_high_raw_model_response,raw_model_response.vote_punish_low_cost,raw_model_response.vote_punish_low_input_price_per_million_tokens,raw_model_response.vote_punish_low_input_tokens,raw_model_response.vote_punish_low_one_usd_buys,raw_model_response.vote_punish_low_output_price_per_million_tokens,raw_model_response.vote_punish_low_output_tokens,raw_model_response.vote_punish_low_raw_model_response,reasoning_summary.vote_punish_high_reasoning_summary,reasoning_summary.vote_punish_low_reasoning_summary,scenario.scenario_index,validated.vote_punish_high_validated,validated.vote_punish_low_validated
0,You are answering questions as if you were a human. Do not break character.,subject_1,No,Yes,4cd1186e2e6531ab31e9fe5f0600cd45,3258f20f8083fc5c31febd0c8bf0c422,True,False,"Punishing individuals for contributing above the group average can discourage excellence, reduce overall group performance, and create a toxic environment that undermines motivation and fairness. High contributors should be encouraged, not penalized, to foster growth and achievement.","Allowing punishment of below-average contributors deters free-riding, incentivizes higher contributions, and can improve the group's overall welfare despite the costs of punishment.","No

Punishing individuals for contributing above the group average can discourage excellence, reduce overall group performance, and create a toxic environment that undermines motivation and fairness. High contributors should be encouraged, not penalized, to foster growth and achievement.","Yes
Allowing punishment of below-average contributors deters free-riding, incentivizes higher contributions, and can improve the group's overall welfare despite the costs of punishment.",0,0,open_router,False,100000,stepfun/step-3.5-flash,0,0,,0.5,3,1,,"
Should members be ALLOWED to punish those who contribute ABOVE the group average?

    
Yes
    
No
    

Only 1 option may be selected.

Respond only with a string corresponding to one of the options.


After the answer, you can put a comment explaining why you chose that option on the next line.
",,"
Your group will vote on punishment rules. Punishment costs 1 token to the punisher and removes 3 tokens from the target. 
Should members be ALLOWED to punish those who contribute BELOW the group average?

    
Yes
    
No
    

Only 1 option may be selected.

Respond only with a string corresponding to one of the options.


After the answer, you can put a comment explaining why you chose that option on the next line.
","['Yes', 'No']","['Yes', 'No']",Should members be ALLOWED to punish those who contribute ABOVE the group average?,"Your group will vote on punishment rules. Punishment costs 1 token to the punisher and removes 3 tokens from the target. 
Should members be ALLOWED to punish those who contribute BELOW the group average?",multiple_choice,multiple_choice,0.000685,1.0,75,1459.8540145985403,1.0,610,"{'id': 'gen-1775753192-sr5tGJ3TrRC6RZ5ybMZ3', 'choices': [{'finish_reason': 'stop', 'index': 0, 'logprobs': None, 'message': {'content': 'No\n\nPunishing individuals for contributing above the group average can discourage excellence, reduce overall group performance, and create a toxic environment that undermines motivation and fairness. High contributors should be encouraged, not penalized, to foster growth and achievement.', 'refusal': None, 'role': 'assistant', 'annotations': None, 'audio': None, 'function_call': None, 'tool_calls': None, 'reasoning': 'First, the user asks: ""Should members be ALLOWED to punish those who contribute ABOVE the group average?"" with options ""Yes"" or ""No"". I must select only one option and respond with a string corresponding to that option. After that, I can add a comment explaining why on the next line.\n\nThe question is about whether members should be allowed to punish those who contribute above the group average. This seems like a social or ethical dilemma, possibly related to group dynamics, fairness, or incentive structures.\n\nKey points to consider:\n\n- Punishing someone for contributing above average might discourage high performance or create a negative environment.\n\n- In some contexts, like cooperative groups, high contributors might be resented or seen as showing off, leading to social punishment.\n\n- But is it ""allowed""? This implies a rule or permission within a group. Should groups permit such punishment?\n\nFrom a rational perspective, punishing high contributors could be counterproductive. It might reduce overall group performance if high performers are discouraged.\n\nHowever, in some social settings, there might be norms against ""rising above"" to maintain equality, but punishing above-average contribution seems extreme.\n\nI need to choose between ""Yes"" or ""No"". The instruction says ""Only 1 option may be selected."" and ""Respond only with a string corresponding to one of the options."" So, I should start my response with either ""Yes"" or ""No"".\n\nAfter that, I can put a comment on the next line explaining why.\n\nMy initial thought: No, members should not be allowed to punish those who contribute above the group average. This could lead to a toxic environment, reduce motivation, and harm group goals. High contributors should be encouraged, not punished.\n\nBut let\'s think about scenarios: In some egalitarian societies or groups, there might be pressures to conform, but formal punishment for over-contribution seems unjust.\n\nPerhaps the question is about whether it should be permitted as a rule. I think it\'s generally not advisable.\n\nSo, I\'ll go with ""No"".\n\nNow, for the comment: I need to explain why I chose that option. Keep it concise.\n\nResponse structure:\n\nFirst line: ""No"" (or ""Yes"", but I\'m choosing No)\n\nSecond line: Comment explaining.\n\nEnsure the response is only the string for the option first, then the comment.\n\nThe user said: ""Respond only with a string corresponding to one of the options."" So, the first part should be just ""No"" or ""Yes"". Then, after that, I can add the comment.\n\nTo be precise, I\'ll write:\n\nNo\n\n[comment]\n\nBut in the response, I should have ""No"" on the first line, and then the explanation on the next line.\n\nFinal decision: I select ""No"".', 'reasoning_details': [{'type': 'reasoning.text', 'text': 'First, the user asks: ""Should members be ALLOWED to punish those who contribute ABOVE the group average?"" with options ""Yes"" or ""No"". I must select only one option and respond with a string corresponding to that option. After that, I can add a comment explaining why on the next line.\n\nThe question is about whether members should be allowed to punish those who contribute above the group average. This seems like a social or ethical dilemma, possibly related to group dynamics, fairness, or incentive structures.\n\nKey points to consider:\n\n- Punishing someone for contributing above average might discourage high performance or create a negative environment.\n\n- In some contexts, like cooperative groups, high contributors might be resented or seen as showing off, leading to social punishment.\n\n- But is it ""allowed""? This implies a rule or permission within a group. Should groups permit such punishment?\n\nFrom a rational perspective, punishing high contributors could be counterproductive. It might reduce overall group performance if high performers are discouraged.\n\nHowever, in some social settings, there might be norms against ""rising above"" to maintain equality, but punishing above-average contribution seems extreme.\n\nI need to choose between ""Yes"" or ""No"". The instruction says ""Only 1 option may be selected."" and ""Respond only with a string corresponding to one of the options."" So, I should start my response with either ""Yes"" or ""No"".\n\nAfter that, I can put a comment on the next line explaining why.\n\nMy initial thought: No, members should not be allowed to punish those who contribute above the group average. This could lead to a toxic environment, reduce motivation, and harm group goals. High contributors should be encouraged, not punished.\n\nBut let\'s think about scenarios: In some egalitarian societies or groups, there might be pressures to conform, but formal punishment for over-contribution seems unjust.\n\nPerhaps the question is about whether it should be permitted as a rule. I think it\'s generally not advisable.\n\nSo, I\'ll go with ""No"".\n\nNow, for the comment: I need to explain why I chose that option. Keep it concise.\n\nResponse structure:\n\nFirst line: ""No"" (or ""Yes"", but I\'m choosing No)\n\nSecond line: Comment explaining.\n\nEnsure the response is only the string for the option first, then the comment.\n\nThe user said: ""Respond only with a string corresponding to one of the options."" So, the first part should be just ""No"" or ""Yes"". Then, after that, I can add the comment.\n\nTo be precise, I\'ll write:\n\nNo\n\n[comment]\n\nBut in the response, I should have ""No"" on the first line, and then the explanation on the next line.\n\nFinal decision: I select ""No"".', 'format': 'unknown', 'index': 0}]}, 'native_finish_reason': 'stop'}], 'created': 1775753192, 'model': 'stepfun/step-3.5-flash', 'object': 'chat.completion', 'service_tier': None, 'system_fingerprint': None, 'usage': {'completion_tokens': 610, 'prompt_tokens': 75, 'total_tokens': 685, 'completion_tokens_details': {'accepted_prediction_tokens': None, 'audio_tokens': 0, 'reasoning_tokens': 708, 'rejected_prediction_tokens': None, 'image_tokens': 0}, 'prompt_tokens_details': {'audio_tokens': 0, 'cached_tokens': 0, 'cache_write_tokens': 0, 'video_tokens': 0}, 'cost': 0.0001905, 'is_byok': False, 'cost_details': {'upstream_inference_cost': 0.0001905, 'upstream_inference_prompt_cost': 7.5e-06, 'upstream_inference_completions_cost': 0.000183}}, 'provider': 'StepFun'}",0.0009969999999999,1.0,103,1003.009027081244,1.0,894,"{'id': 'gen-1775753192-Ru4ycMz2w11G1ICK7YKZ', 'choices': [{'finish_reason': 'stop', 'index': 0, 'logprobs': None, 'message': {'content': ""Yes\nAllowing punishment of below-average contributors deters free-riding, incentivizes higher contributions, and can improve the group's overall welfare despite the costs of punishment."", 'refusal': None, 'role': 'assistant', 'annotations': None, 'audio': None, 'function_call': None, 'tool_calls': None, 'reasoning': 'We need to answer with either ""Yes"" or ""No"". The question: ""Should members be ALLOWED to punish those who contribute BELOW the group average?"" It\'s a group voting on punishment rules. Punishment costs 1 token to the punisher and removes 3 tokens from the target. So it\'s a costly punishment mechanism. The question is whether to allow members to punish those who contribute below the group average. This is reminiscent of public goods games where punishment can enforce cooperation. Typically, allowing punishment of low contributors can increase contributions, but it also has costs. The question is about whether to allow it. Probably the answer is ""Yes"" because it can incentivize higher contributions and maintain group welfare. But we need to consider the specifics: punishment costs 1 token to punisher, removes 3 from target. That\'s a net loss of 2 tokens total (punisher loses 1, target loses 3). So it\'s a net negative sum transfer. That might be inefficient if used excessively. However, the threat of punishment can encourage contributions, potentially increasing the public good. The question is about allowing punishment of those below average. In many experiments, allowing punishment increases cooperation. But there is also the possibility of antisocial punishment or misuse. The question likely expects a normative answer based on efficiency or fairness. Since it\'s a group voting, we need to decide what\'s best for the group. If punishment is allowed, it might raise contributions, but the cost of punishment might reduce total tokens. However, if contributions are below average, they are free-riding, so punishing them might increase overall contribution levels. Typically, in public goods games, the group average contribution is often used as a reference point. Punishing below-average contributors can raise the average. But is it efficient? Let\'s consider a simple model: each member has an endowment, they contribute some to a public good, which is multiplied and shared. Punishment can be used after contributions. If punishment is allowed, individuals may contribute more to avoid being punished. The cost of punishment is borne by punisher and target. But if it increases contributions, the public good benefit might outweigh the punishment costs. However, the net effect depends on parameters. In many studies, punishment improves cooperation but at a cost. The question is binary: allow or not. Usually, groups that implement punishment have higher payoffs. So I\'d say ""Yes"". But we need to consider if punishing below average is too harsh? Maybe it\'s better to allow punishment but not necessarily only below average? The question specifically asks about allowing punishment of those below average. That seems like a rule that permits punishment only if the target\'s contribution is below the group average. That\'s a conditional punishment. That might be reasonable because it targets free-riders. So I\'d vote Yes. But let\'s think: Could there be a scenario where everyone contributes the same, then no one is below average, so no punishment. That\'s fine. If someone contributes less, they can be punished. That incentivizes not to under-contribute. So it\'s a mechanism to sustain cooperation. So I\'ll answer Yes.\n\nBut we must respond only with a string corresponding to one of the options, and then after the answer we can put a comment explaining why we chose that option on the next line. So output should be:\n\nYes\n[explanation]\n\nBut the instruction says: ""Respond only with a string corresponding to one of the options. After the answer, you can put a comment explaining why you chose that option on the next line."" So first line is the answer, second line is comment. So we need to output exactly that.\n\nThus answer: Yes.\n\nNow explanation: Because allowing punishment of below-average contributors can incentivize higher contributions and reduce free-riding, leading to better group outcomes despite the costs.\n\nBut we need to be concise? It says ""you can put a comment explaining why you chose that option on the next line."" So we can write a brief reason.\n\nI\'ll output:\n\nYes\nAllowing punishment of those who contribute below the group average helps deter free-riding and encourages higher contributions, which can improve the group\'s overall welfare despite the costs of punishment.\n\nThat should be fine.', 'reasoning_details': [{'type': 'reasoning.text', 'text': 'We need to answer with either ""Yes"" or ""No"". The question: ""Should members be ALLOWED to punish those who contribute BELOW the group average?"" It\'s a group voting on punishment rules. Punishment costs 1 token to the punisher and removes 3 tokens from the target. So it\'s a costly punishment mechanism. The question is whether to allow members to punish those who contribute below the group average. This is reminiscent of public goods games where punishment can enforce cooperation. Typically, allowing punishment of low contributors can increase contributions, but it also has costs. The question is about whether to allow it. Probably the answer is ""Yes"" because it can incentivize higher contributions and maintain group welfare. But we need to consider the specifics: punishment costs 1 token to punisher, removes 3 from target. That\'s a net loss of 2 tokens total (punisher loses 1, target loses 3). So it\'s a net negative sum transfer. That might be inefficient if used excessively. However, the threat of punishment can encourage contributions, potentially increasing the public good. The question is about allowing punishment of those below average. In many experiments, allowing punishment increases cooperation. But there is also the possibility of antisocial punishment or misuse. The question likely expects a normative answer based on efficiency or fairness. Since it\'s a group voting, we need to decide what\'s best for the group. If punishment is allowed, it might raise contributions, but the cost of punishment might reduce total tokens. However, if contributions are below average, they are free-riding, so punishing them might increase overall contribution levels. Typically, in public goods games, the group average contribution is often used as a reference point. Punishing below-average contributors can raise the average. But is it efficient? Let\'s consider a simple model: each member has an endowment, they contribute some to a public good, which is multiplied and shared. Punishment can be used after contributions. If punishment is allowed, individuals may contribute more to avoid being punished. The cost of punishment is borne by punisher and target. But if it increases contributions, the public good benefit might outweigh the punishment costs. However, the net effect depends on parameters. In many studies, punishment improves cooperation but at a cost. The question is binary: allow or not. Usually, groups that implement punishment have higher payoffs. So I\'d say ""Yes"". But we need to consider if punishing below average is too harsh? Maybe it\'s better to allow punishment but not necessarily only below average? The question specifically asks about allowing punishment of those below average. That seems like a rule that permits punishment only if the target\'s contribution is below the group average. That\'s a conditional punishment. That might be reasonable because it targets free-riders. So I\'d vote Yes. But let\'s think: Could there be a scenario where everyone contributes the same, then no one is below average, so no punishment. That\'s fine. If someone contributes less, they can be punished. That incentivizes not to under-contribute. So it\'s a mechanism to sustain cooperation. So I\'ll answer Yes.\n\nBut we must respond only with a string corresponding to one of the options, and then after the answer we can put a comment explaining why we chose that option on the next line. So output should be:\n\nYes\n[explanation]\n\nBut the instruction says: ""Respond only with a string corresponding to one of the options. After the answer, you can put a comment explaining why you chose that option on the next line."" So first line is the answer, second line is comment. So we need to output exactly that.\n\nThus answer: Yes.\n\nNow explanation: Because allowing punishment of below-average contributors can incentivize higher contributions and reduce free-riding, leading to better group outcomes despite the costs.\n\nBut we need to be concise? It says ""you can put a comment explaining why you chose that option on the next line."" So we can write a brief reason.\n\nI\'ll output:\n\nYes\nAllowing punishment of those who contribute below the group average helps deter free-riding and encourages higher contributions, which can improve the group\'s overall welfare despite the costs of punishment.\n\nThat should be fine.', 'format': 'unknown', 'index': 0}]}, 'native_finish_reason': 'stop'}], 'created': 1775753192, 'model': 'stepfun/step-3.5-flash', 'object': 'chat.completion', 'service_tier': None, 'system_fingerprint': None, 'usage': {'completion_tokens': 894, 'prompt_tokens': 103, 'total_tokens': 997, 'completion_tokens_details': {'accepted_prediction_tokens': None, 'audio_tokens': 0, 'reasoning_tokens': 1101, 'rejected_prediction_tokens': None, 'image_tokens': 0}, 'prompt_tokens_details': {'audio_tokens': 0, 'cached_tokens': 0, 'cache_write_tokens': 0, 'video_tokens': 0}, 'cost': 0.0002785, 'is_byok': False, 'cost_details': {'upstream_inference_cost': 0.0002785, 'upstream_inference_prompt_cost': 1.03e-05, 'upstream_inference_completions_cost': 0.0002682}}, 'provider': 'StepFun'}",,,0,True,True
